[
  {
    "name": "Senso-ji Temple",
    "category": "temple",
    "city": "Tokyo",
    "description": "Tokyo's oldest temple, founded in 628 AD",
    "location": {
      "type": "Point",
      "coordinates": [
        139.7967,
        35.7148
      ]
    }
  },
  {
    "name": "Meiji Shrine",
    "category": "shrine",
    "city": "Tokyo",
    "description": "Shinto shrine dedicated to Emperor Meiji",
    "location": {
      "type": "Point",
      "coordinates": [
        139.6993,
        35.6763
      ]
    }
  },
  {
    "name": "Shinjuku Gyoen",
    "category": "garden",
    "city": "Tokyo",
    "description": "Large national garden blending French and English styles",
    "location": {
      "type": "Point",
      "coordinates": [
        139.71,
        35.6852
      ]
    }
  },
  {
    "name": "Ueno Park",
    "category": "garden",
    "city": "Tokyo",
    "description": "Famous park housing multiple museums and a zoo",
    "location": {
      "type": "Point",
      "coordinates": [
        139.7714,
        35.7146
      ]
    }
  },
  {
    "name": "Yasukuni Shrine",
    "category": "shrine",
    "city": "Tokyo",
    "description": "Shinto shrine commemorating Japan's war dead",
    "location": {
      "type": "Point",
      "coordinates": [
        139.7433,
        35.6938
      ]
    }
  },
  {
    "name": "Hamarikyu Gardens",
    "category": "garden",
    "city": "Tokyo",
    "description": "Tidal garden with teahouse surrounded by skyscrapers",
    "location": {
      "type": "Point",
      "coordinates": [
        139.7635,
        35.6597
      ]
    }
  },
  {
    "name": "Nezu Shrine",
    "category": "shrine",
    "city": "Tokyo",
    "description": "One of Tokyo's oldest shrines with torii-lined paths",
    "location": {
      "type": "Point",
      "coordinates": [
        139.7598,
        35.7208
      ]
    }
  },
  {
    "name": "Yanaka Cemetery",
    "category": "historic",
    "city": "Tokyo",
    "description": "Historic cemetery with old temples and cherry blossoms",
    "location": {
      "type": "Point",
      "coordinates": [
        139.7706,
        35.7261
      ]
    }
  },
  {
    "name": "Edo-Tokyo Museum",
    "category": "museum",
    "city": "Tokyo",
    "description": "Museum showcasing the history of Tokyo from Edo period",
    "location": {
      "type": "Point",
      "coordinates": [
        139.7966,
        35.6966
      ]
    }
  },
  {
    "name": "Imperial Palace East Garden",
    "category": "garden",
    "city": "Tokyo",
    "description": "Former site of Edo Castle's innermost citadel",
    "location": {
      "type": "Point",
      "coordinates": [
        139.7581,
        35.6863
      ]
    }
  },
  {
    "name": "Fushimi Inari Shrine",
    "category": "shrine",
    "city": "Kyoto",
    "description": "Famous for thousands of vermillion torii gates",
    "location": {
      "type": "Point",
      "coordinates": [
        135.7727,
        34.9671
      ]
    }
  },
  {
    "name": "Kinkaku-ji Temple",
    "category": "temple",
    "city": "Kyoto",
    "description": "The Golden Pavilion, covered in gold leaf",
    "location": {
      "type": "Point",
      "coordinates": [
        135.7292,
        35.0394
      ]
    }
  },
  {
    "name": "Ginkaku-ji Temple",
    "category": "temple",
    "city": "Kyoto",
    "description": "The Silver Pavilion with zen garden",
    "location": {
      "type": "Point",
      "coordinates": [
        135.7982,
        35.0269
      ]
    }
  },
  {
    "name": "Ryoan-ji Temple",
    "category": "temple",
    "city": "Kyoto",
    "description": "Famous for its enigmatic rock garden",
    "location": {
      "type": "Point",
      "coordinates": [
        135.7178,
        35.0345
      ]
    }
  },
  {
    "name": "Kiyomizu-dera Temple",
    "category": "temple",
    "city": "Kyoto",
    "description": "Iconic temple with wooden stage over a hillside",
    "location": {
      "type": "Point",
      "coordinates": [
        135.785,
        34.9949
      ]
    }
  },
  {
    "name": "Nijo Castle",
    "category": "castle",
    "city": "Kyoto",
    "description": "Flatland castle of the Tokugawa shoguns",
    "location": {
      "type": "Point",
      "coordinates": [
        135.748,
        35.0142
      ]
    }
  },
  {
    "name": "Arashiyama Bamboo Grove",
    "category": "garden",
    "city": "Kyoto",
    "description": "Towering bamboo forest in the Arashiyama district",
    "location": {
      "type": "Point",
      "coordinates": [
        135.6726,
        35.0094
      ]
    }
  },
  {
    "name": "Tenryu-ji Temple",
    "category": "temple",
    "city": "Kyoto",
    "description": "UNESCO World Heritage Zen temple with pond garden",
    "location": {
      "type": "Point",
      "coordinates": [
        135.6753,
        35.0153
      ]
    }
  },
  {
    "name": "Philosopher's Path",
    "category": "historic",
    "city": "Kyoto",
    "description": "Canal-side stone path lined with cherry trees",
    "location": {
      "type": "Point",
      "coordinates": [
        135.7982,
        35.02
      ]
    }
  },
  {
    "name": "Heian Shrine",
    "category": "shrine",
    "city": "Kyoto",
    "description": "Shrine built to commemorate Kyoto's 1100th anniversary",
    "location": {
      "type": "Point",
      "coordinates": [
        135.7824,
        35.016
      ]
    }
  },
  {
    "name": "Nishiki Market",
    "category": "historic",
    "city": "Kyoto",
    "description": "Narrow shopping street known as Kyoto's Kitchen",
    "location": {
      "type": "Point",
      "coordinates": [
        135.7654,
        35.005
      ]
    }
  },
  {
    "name": "Daitoku-ji Temple",
    "category": "temple",
    "city": "Kyoto",
    "description": "Zen temple complex with 24 sub-temples",
    "location": {
      "type": "Point",
      "coordinates": [
        135.746,
        35.0437
      ]
    }
  },
  {
    "name": "Sanjusangen-do Temple",
    "category": "temple",
    "city": "Kyoto",
    "description": "Hall with 1001 statues of Thousand-armed Kannon",
    "location": {
      "type": "Point",
      "coordinates": [
        135.7739,
        34.9882
      ]
    }
  },
  {
    "name": "Pontocho Alley",
    "category": "historic",
    "city": "Kyoto",
    "description": "Narrow alley famous for traditional restaurants",
    "location": {
      "type": "Point",
      "coordinates": [
        135.7716,
        35.0057
      ]
    }
  },
  {
    "name": "Todai-ji Temple",
    "category": "temple",
    "city": "Nara",
    "description": "Houses Japan's largest bronze Buddha statue",
    "location": {
      "type": "Point",
      "coordinates": [
        135.8398,
        34.6888
      ]
    }
  },
  {
    "name": "Kasuga Taisha Shrine",
    "category": "shrine",
    "city": "Nara",
    "description": "Famous for its thousands of bronze and stone lanterns",
    "location": {
      "type": "Point",
      "coordinates": [
        135.848,
        34.6813
      ]
    }
  },
  {
    "name": "Nara Park",
    "category": "garden",
    "city": "Nara",
    "description": "Expansive park home to hundreds of freely roaming deer",
    "location": {
      "type": "Point",
      "coordinates": [
        135.8432,
        34.6851
      ]
    }
  },
  {
    "name": "Horyu-ji Temple",
    "category": "temple",
    "city": "Nara",
    "description": "World's oldest surviving wooden structures",
    "location": {
      "type": "Point",
      "coordinates": [
        135.7345,
        34.6147
      ]
    }
  },
  {
    "name": "Isuien Garden",
    "category": "garden",
    "city": "Nara",
    "description": "Traditional Japanese garden with views of Todai-ji",
    "location": {
      "type": "Point",
      "coordinates": [
        135.8442,
        34.6841
      ]
    }
  },
  {
    "name": "Kofuku-ji Temple",
    "category": "temple",
    "city": "Nara",
    "description": "Five-story pagoda that is a symbol of Nara",
    "location": {
      "type": "Point",
      "coordinates": [
        135.8319,
        34.6815
      ]
    }
  },
  {
    "name": "Osaka Castle",
    "category": "castle",
    "city": "Osaka",
    "description": "Iconic castle that played a major role in unification of Japan",
    "location": {
      "type": "Point",
      "coordinates": [
        135.5259,
        34.6873
      ]
    }
  },
  {
    "name": "Sumiyoshi Taisha Shrine",
    "category": "shrine",
    "city": "Osaka",
    "description": "One of the oldest Shinto shrines in Japan",
    "location": {
      "type": "Point",
      "coordinates": [
        135.493,
        34.6132
      ]
    }
  },
  {
    "name": "Shitenno-ji Temple",
    "category": "temple",
    "city": "Osaka",
    "description": "One of Japan's oldest Buddhist temples",
    "location": {
      "type": "Point",
      "coordinates": [
        135.5163,
        34.6538
      ]
    }
  },
  {
    "name": "Namba Yasaka Shrine",
    "category": "shrine",
    "city": "Osaka",
    "description": "Shrine famous for its giant lion-head stage",
    "location": {
      "type": "Point",
      "coordinates": [
        135.5019,
        34.667
      ]
    }
  },
  {
    "name": "Expo '70 Commemorative Park",
    "category": "garden",
    "city": "Osaka",
    "description": "Large park built on the site of the 1970 World Exposition",
    "location": {
      "type": "Point",
      "coordinates": [
        135.5376,
        34.8054
      ]
    }
  },
  {
    "name": "Itsukushima Shrine",
    "category": "shrine",
    "city": "Hiroshima",
    "description": "Famous floating torii gate on the sea",
    "location": {
      "type": "Point",
      "coordinates": [
        132.3197,
        34.296
      ]
    }
  },
  {
    "name": "Hiroshima Peace Memorial",
    "category": "historic",
    "city": "Hiroshima",
    "description": "UNESCO site preserving the A-Bomb Dome",
    "location": {
      "type": "Point",
      "coordinates": [
        132.4532,
        34.3955
      ]
    }
  },
  {